{
  "benchmark_id": "bench.examples.campaign.neutral.v1",
  "cell_id": "v-repo__q03",
  "created_at": "1970-01-01T00:00:00Z",
  "id": "req__examples-campaign-neutral__v-repo__q03",
  "model": "mock-model",
  "prompt_id": "q03",
  "prompt_text": "Propose a minimal experiment protocol to compare two local LLM backends on the same prompt set, including what you would log per run.",
  "run_id": "examples-campaign-neutral",
  "schema_version": 1,
  "variant_id": "v-repo"
}
