{
  "benchmark_id": "bench.examples.campaign.success_heavy.v1",
  "cell_id": "v-cli__q14",
  "created_at": "1970-01-01T00:00:00Z",
  "id": "req__examples-campaign-success-heavy__v-cli__q14",
  "model": "mock-model",
  "prompt_id": "q14",
  "prompt_text": "Explain how reproducible file naming under cells/ helps reviewers trust a benchmark campaign without re-running models.",
  "run_id": "examples-campaign-success-heavy",
  "schema_version": 1,
  "variant_id": "v-cli"
}
