{
  "benchmark_id": "bench.examples.campaign.neutral.v1",
  "cell_id": "v-browser__q01",
  "created_at": "1970-01-01T00:00:00Z",
  "id": "req__examples-campaign-neutral__v-browser__q01",
  "model": "mock-model",
  "prompt_id": "q01",
  "prompt_text": "Summarize how you would structure a small RAG pipeline for Markdown notes in a git repo, including where JSON Schema validation fits.",
  "run_id": "examples-campaign-neutral",
  "schema_version": 1,
  "variant_id": "v-browser"
}
