{
  "benchmark_id": "bench.examples.campaign.neutral.v1",
  "cell_id": "v-repo__q05",
  "created_at": "1970-01-01T00:00:00Z",
  "id": "req__examples-campaign-neutral__v-repo__q05",
  "model": "mock-model",
  "prompt_id": "q05",
  "prompt_text": "Draft a short checklist for reviewing an agent-generated pull request that adds a new JSON artifact schema.",
  "run_id": "examples-campaign-neutral",
  "schema_version": 1,
  "variant_id": "v-repo"
}
