{
  "benchmark_id": "bench.examples.campaign.success_heavy.v1",
  "cell_id": "v-browser__q11",
  "created_at": "1970-01-01T00:00:00Z",
  "id": "req__examples-campaign-success-heavy__v-browser__q11",
  "model": "mock-model",
  "prompt_id": "q11",
  "prompt_text": "Celebrate a green CI run: list what artifacts you would attach to the weekly report when lint, typecheck, and offline benchmarks all pass.",
  "run_id": "examples-campaign-success-heavy",
  "schema_version": 1,
  "variant_id": "v-browser"
}
