{
  "benchmark_id": "bench.examples.campaign.neutral.v1",
  "cell_id": "v-repo__q02",
  "created_at": "1970-01-01T00:00:00Z",
  "id": "req__examples-campaign-neutral__v-repo__q02",
  "model": "mock-model",
  "prompt_id": "q02",
  "prompt_text": "List three trade-offs between dense retrieval and lexical search for agent tool-calling documentation, in under 120 words.",
  "run_id": "examples-campaign-neutral",
  "schema_version": 1,
  "variant_id": "v-repo"
}
